{
    "id":  "task-scope-success-criteria-to-check-time-evaluable-facts",
    "summary":  "Add guidance (to pmcro-planner\u0027s plan contract, e.g. run.plan.asset.md step 2) that a PlanFrame\u0027s success_criteria must only assert facts Checker can independently verify as already true by the time check.jsonl is written -- never an outcome owned by a later phase (e.g. Reflector\u0027s own Reflection/seal). Cross-reference from pmcro-checker\u0027s run.check.asset.md so Checker knows to treat such a criterion as a planning defect (FAIL with that explanation) rather than inventing a \u0027pending\u0027 rationale.",
    "proposed_role":  "maker",
    "source_trail_id":  "0aa1c59d-6941-4692-9d40-4b893eb9fe5d",
    "created_at":  "2026-09-04T17:49:17.9877219Z",
    "status":  "open"
}
