{
  "id": "task-hand-run-full-five-plugin-cycle",
  "summary": "Hand-run one full cycle using the five real plugins end-to-end on a trivial real task, to prove the orchestrate -> plan -> make -> check -> reflect-and-seed contracts actually compose in practice, not just that each validates in isolation.",
  "proposed_role": "maker",
  "source_trail_id": "fdeb45a6-3312-40cd-83c3-c6a870ade67f",
  "created_at": "2026-09-04T00:20:00Z",
  "status": "open"
}
